"La Suite West, Bayswater, Central London - save 50%",England,HOTEL,135,50,2018-02-19 00:01:00.000000,2018-02-27 23:59:00.000000,8,12
"Matfen Hall, Matfen, Northumberland - save 60%",England,HOTEL,89,60,2018-02-19 00:01:00.000000,2018-02-27 23:59:00.000000,8,12
"MANATHAI Koh Samui, Koh Samui, Thailand - save 52%",Thailand,HOTEL,2300,52,2018-02-19 00:01:00.000000,2018-02-26 23:59:00.000000,7,12
"The White Horse Hotel, Dorking, Surrey - save 45%",England,HOTEL,114,45,2018-02-19 00:01:00.000000,2018-02-27 23:59:00.000000,8,12
"Relaxing Jersey break at an award-winning hotel, Hotel La Place, St Brelade - save 36%",England,PACKAGE,378,36,2018-01-19 00:01:00.000000,2018-02-26 23:59:00.000000,38,11
"Dreamy Mauritius & Dubai holiday, Solana Beach Mauritius & Hilton Garden Inn Dubai Mall of the Emirates - save 48%",Mauritius,PACKAGE,2798,48,2018-02-02 00:01:00.000000,2018-02-26 23:59:00.000000,24,11
"Anantara Uluwatu Bali Resort, An extras-packed getaway in Bali, Indonesia - save 40%",Indonesia,PACKAGE,1188,40,2018-02-04 00:01:00.000000,2018-02-26 23:59:00.000000,22,11
"Elegant Bruges break with Eurostar or Eurotunnel travel, Hotel Prinsenhof, Belgium - save 30%",Belgium,PACKAGE,370,30,2018-02-09 00:01:00.000000,2018-02-26 23:59:00.000000,17,11
"Dale Lodge Hotel, Grasmere, Lake District - save 48%",England,HOTEL,129,48,2018-02-19 00:01:00.000000,2018-02-27 23:59:00.000000,8,10
"Mallorca holiday with penthouse suite & optional all-inclusive, Zafiro Palace Palmanova, Spain - save 34%",Spain,PACKAGE,670,34,2018-02-09 00:01:00.000000,2018-02-26 23:59:00.000000,17,10
"Grand Hotel in Porto Cervo, Porto Cervo, Italy - save 33%",Italy,HOTEL,139,33,2018-02-18 00:01:00.000000,2018-02-26 23:59:00.000000,8,10
"Wyndham Halcyon Resort La Souterraine, Limousin, France - save 63%",France,HOTEL,95,63,2018-02-05 00:01:00.000000,2018-02-26 23:59:00.000000,21,10
"Hotel Plaza Duće, Duće, Croatia - save 39%",Croatia,HOTEL,86,39,2018-02-05 00:01:00.000000,2018-02-26 23:59:00.000000,21,10
"Stunning Iceland wellness city & country break with tours, A five-day tour with Northern Lights, Blue Lagoon & more - save 38%",Iceland,PACKAGE,1298,38,2018-02-02 00:01:00.000000,2018-02-26 23:59:00.000000,24,10
"Le Tourville Eiffel, Paris, France - save 38%",France,HOTEL,139,38,2018-02-19 00:01:00.000000,2018-02-26 23:59:00.000000,7,9
"La Perla by Sedar, Como, Italy - save 43%",Italy,HOTEL,105,43,2018-02-12 00:01:00.000000,2018-02-26 23:59:00.000000,14,9
"Prasana by Arjani Resorts, Bali, Indonesia - save 47%",Indonesia,HOTEL,180,47,2018-02-11 00:01:00.000000,2018-02-26 23:59:00.000000,15,9
"Senetan Villas & Spa Resort, Bali, Indonesia - save 61%",Indonesia,HOTEL,125,61,2018-02-18 00:01:00.000000,2018-02-26 23:59:00.000000,8,9
"Marwell Hotel, Winchester, Hampshire - save 36%",England,HOTEL,129,36,2018-02-20 00:01:00.000000,2018-02-27 23:59:00.000000,7,9
"Boutique Ischia spa holiday, Villa Svizzera Hotel & Spa, Italy - save 37%",Italy,PACKAGE,918,37,2018-02-14 00:01:00.000000,2018-02-26 23:59:00.000000,12,9
"Lake Maggiore foodie holiday with spectacular views, Albergo Colonne, Italy - save 30%",Italy,PACKAGE,750,30,2018-02-16 00:01:00.000000,2018-02-26 23:59:00.000000,10,9
"Elegant Prague break with optional sightseeing bus tickets, Mamaison Hotel Riverside Prague, Czech Republic - save 27%",Czech Republic,PACKAGE,498,27,2018-02-16 00:01:00.000000,2018-02-26 23:59:00.000000,10,8
"Le Méridien Lav, Split, Split, Croatia - save 43%",Croatia,HOTEL,89,43,2018-02-11 00:01:00.000000,2018-02-26 23:59:00.000000,15,8
"All-inclusive Tobago escape with ocean views, Tropikist Beach Hotel & Resort, Crown Point - save 50%",Trinidad And Tobago,PACKAGE,1598,50,2018-02-09 00:01:00.000000,2018-02-26 23:59:00.000000,17,8
"Terra Mia, Marrakech, Morocco - save 37%",Morocco,HOTEL,56.25,37,2018-02-12 00:01:00.000000,2018-02-26 23:59:00.000000,14,8
"Riad Al Mendili Kasbah, Near Marrakech, Morocco - save 43%",Morocco,HOTEL,106.25,43,2018-02-18 00:01:00.000000,2018-02-26 23:59:00.000000,8,8
"Hotel Cap Negret, Altea, Spain - save 54%",Spain,HOTEL,70.4,54,2018-02-18 00:01:00.000000,2018-02-26 23:59:00.000000,8,8
"5* all-inclusive Mexico holiday with plunge pool & Jacuzzi suite, Beloved Playa Mujeres, Cancun - save 45%",Mexico,PACKAGE,2598,45,2018-01-26 00:01:00.000000,2018-02-26 23:59:00.000000,31,8
"The Spa Retreat Boutique Hotel, Negril, Jamaica - save 36%",Jamaica,HOTEL,128,36,2018-02-18 00:01:00.000000,2018-02-27 04:59:00.000000,9,8
"Marlin Canary Wharf, Canary Wharf, London - save 67%",England,HOTEL,79,67,2018-02-12 00:01:00.000000,2018-02-27 23:59:00.000000,15,8
"Grove of Narberth, Pembrokeshire, Wales - save 53%",Wales/Cymru,HOTEL,149,53,2018-02-18 00:01:00.000000,2018-02-27 23:59:00.000000,9,8
"Hotel La Hacienda del Buen Suceso, Gran Canaria, Canary Islands - save 35%",Spain,HOTEL,98,35,2018-02-19 00:01:00.000000,2018-02-26 23:59:00.000000,7,8
"Holiday Suites Bray-Dunes Etoile de Mer, Opal Coast, France - save 46%",France,HOTEL,199,46,2018-02-19 00:01:00.000000,2018-02-26 23:59:00.000000,7,8
"Hotel Athénée, Toulouse, France - save 38%",France,HOTEL,77,38,2018-02-12 00:01:00.000000,2018-02-26 23:59:00.000000,14,8
"Quinta das Vistas Palace Gardens, Madeira, Portugal - save 39%",Portugal,HOTEL,120,39,2018-02-19 00:01:00.000000,2018-02-26 23:59:00.000000,7,8
"Route Active Hotel, Tenerife, Canary Islands - save 33%",Spain,HOTEL,62.5,33,2018-02-19 00:01:00.000000,2018-02-26 23:59:00.000000,7,8
"Allegria Hotel, Long Beach, New York - save 25%",USA,HOTEL,125,25,2018-02-12 00:01:00.000000,2018-02-27 04:59:00.000000,15,8
"The Chedi Lustica Bay, Tivat, Montenegro - save 64%",Montenegro,HOTEL,193,64,2018-02-19 00:01:00.000000,2018-02-26 23:59:00.000000,7,7
"Jambuluwuk Oceano Resort at Gili Trawangan, Lombok, Indonesia - save 69%",Indonesia,HOTEL,58,69,2018-02-12 00:01:00.000000,2018-02-26 23:59:00.000000,14,7
"Modern Jersey getaway with car hire, Beachcombers Hotel, Channel Islands - save 33%",England,PACKAGE,538,33,2018-02-16 00:01:00.000000,2018-02-26 23:59:00.000000,10,7
"Château de Courcelles, Courcelles-sur-Vesles, near Reims, France - save 39%",France,HOTEL,260,39,2018-02-18 00:01:00.000000,2018-02-26 23:59:00.000000,8,7
"Abu Dhabi escape with desert safari & Ferrari World tickets, Radisson Blu Hotel, Abu Dhabi Yas Island, UAE - save 30%",United Arab Emirates,PACKAGE,1398,30,2018-02-16 00:01:00.000000,2018-02-26 23:59:00.000000,10,7
"French Alps gourmet summer holiday, Chalet Samoëns, Grand Massif - save 19%",France,PACKAGE,1330,19,2018-02-09 00:01:00.000000,2018-02-26 23:59:00.000000,17,7
"Sandton Hôtel & Résidence Domaine Cocagne, Côte d’Azur, France - save 35%",France,HOTEL,129,35,2018-02-19 00:01:00.000000,2018-02-26 23:59:00.000000,7,6
"Elegant Rome, Florence & Venice city-hop, Palladium Palace Hotel, Atlantic Palace Hotel & Hotel Giorgione, Italy - save 38%",Italy,PACKAGE,598,38,2018-02-16 00:01:00.000000,2018-02-26 23:59:00.000000,10,6
"Chic Bruges break with Eurostar or Eurotunnel travel, Hotel Montanus, Belgium - save 31%",Belgium,PACKAGE,278,31,2018-02-16 00:01:00.000000,2018-02-26 23:59:00.000000,10,6
"Memoire Siem Reap Hotel, Siem Reap, Cambodia - save 74%",Cambodia,HOTEL,55,74,2018-02-19 00:01:00.000000,2018-02-26 23:59:00.000000,7,6
"Hotel Le Cavendish, Cannes, France - save 50%",France,HOTEL,123.75,50,2018-02-19 00:01:00.000000,2018-02-26 23:59:00.000000,7,6
"Castello Camemi, Catania, Italy - save 31%",Italy,HOTEL,112,31,2018-02-12 00:01:00.000000,2018-02-26 23:59:00.000000,14,6
"Rocca della Sena, Tropea, Italy - save 44%",Italy,HOTEL,109,44,2018-02-19 00:00:00.000000,2018-02-26 23:59:00.000000,7,6
"Château de Cocove, Nord-Pas-de-Calais, France - save 39%",France,HOTEL,99,39,2018-02-12 00:01:00.000000,2018-02-26 23:59:00.000000,14,6
"Modern Mallorca coastal escape, Hotel Vistamar by Pierre & Vacances, Spain - save 23%",Spain,PACKAGE,498,23,2018-02-16 00:01:00.000000,2018-02-26 23:59:00.000000,10,6
"Vibrant Croatia beachfront spa hotel stay, Radisson Blu Resort Split, Croatia - save 38%",Croatia,PACKAGE,798,38,2018-02-16 00:01:00.000000,2018-02-26 23:59:00.000000,10,6
"Jersey break at a charming & characterful hotel, The Revere Hotel, St Helier - save 40%",England,PACKAGE,398,40,2018-01-30 00:01:00.000000,2018-02-26 23:59:00.000000,27,6
"Lido Palace, Lake Garda, Italy - save 26%",Italy,HOTEL,229,26,2018-02-11 00:01:00.000000,2018-02-26 23:59:00.000000,15,6
"The Plaza New York, Midtown, New York - save 41%",USA,HOTEL,1125,41,2018-02-16 00:01:00.000000,2018-02-27 04:59:00.000000,11,6
"5* Mykonos holiday at a private beach resort, Saint John Mykonos Hotel, Greece - save 46%",Greece,PACKAGE,1198,46,2018-02-16 00:01:00.000000,2018-02-26 23:59:00.000000,10,6
"Fairmont Ajman, Ajman, UAE - save 71%",United Arab Emirates,HOTEL,283.75,71,2018-02-19 00:01:00.000000,2018-02-26 23:59:00.000000,7,6
"FBC Fortuny Resort, Gran Canaria, Spain - save 54%",Spain,HOTEL,87.5,54,2018-02-19 00:01:00.000000,2018-02-26 23:59:00.000000,7,5
"Away Chiang Mai Thapae Resort - A Vegetarian Retreat, Chiang Mai, Thailand - save 48%",Thailand,HOTEL,2400,48,2018-02-19 00:01:00.000000,2018-02-26 23:59:00.000000,7,5
"Picturesque Jersey break with harbour views & car hire, Somerville Hotel, Saint Aubin - save 40%",England,PACKAGE,498,40,2018-02-09 00:01:00.000000,2018-02-26 23:59:00.000000,17,5
"Liscia Country Relais, Sardinia, Italy - save 61%",Italy,HOTEL,85,61,2018-02-19 00:01:00.000000,2018-02-26 23:59:00.000000,7,5
"Relais des Trois Châteaux, Cour-Cherveny, France - save 32%",France,HOTEL,119,32,2018-02-18 00:01:00.000000,2018-02-26 23:59:00.000000,8,5
"5* all-inclusive Cyprus holiday with striking sea views, Coral Bay, Cyprus - save 33%",Cyprus,PACKAGE,598,33,2018-02-16 00:01:00.000000,2018-02-26 23:59:00.000000,10,5
"5* stylish Madeira holiday with sea views, VidaMar Resort Hotel, Portugal - save 36%",Portugal,PACKAGE,1258,36,2018-02-09 00:01:00.000000,2018-02-26 23:59:00.000000,17,5
"Ultra-affordable Andorra ski holiday with a quirky hotel stay, Mu Hotel, Pyrenees - save 34%",Andorra,PACKAGE,798,34,2018-01-11 00:01:00.000000,2018-02-26 23:59:00.000000,46,5
"Boutique Nice break with Monte Carlo night tour, Villa Bougainville, France - save 27%",France,PACKAGE,530,27,2018-02-12 00:01:00.000000,2018-02-22 23:59:00.000000,10,5
"Cheong Fatt Tze - The Blue Mansion, Penang, Malaysia - save 50%",Malaysia,HOTEL,358,50,2018-02-19 00:01:00.000000,2018-02-26 23:59:00.000000,7,5
"5* modern Algarve holiday at a sleek spa resort, Macdonald Monchique Resort & Spa, Portugal - save 34%",Portugal,PACKAGE,578,34,2018-02-16 00:01:00.000000,2018-02-26 23:59:00.000000,10,5
"Lake Maggiore break with stunning views, Villa Carlotta, Italy - save 23%",Italy,PACKAGE,450,23,2018-02-09 00:01:00.000000,2018-02-26 23:59:00.000000,17,5
"All-inclusive beachside Mexico break with generous perks, Hard Rock Hotel Riviera Maya, Mexico - save 50%",Mexico,PACKAGE,2698,50,2018-02-16 00:01:00.000000,2018-02-26 23:59:00.000000,10,5
"Cugó Gran Macina Grand Harbour, Senglea, Malta - save 33%",Malta,HOTEL,206.25,33,2018-02-19 00:01:00.000000,2018-02-26 23:59:00.000000,7,5
"Romantic Tuscany castle break with car hire, Castello di Leonina Relais, Italy - save 36%",Italy,PACKAGE,598,36,2018-02-16 00:01:00.000000,2018-02-26 23:59:00.000000,10,4
"Boutique Paris break with Eurostar travel, Hotel Sacha, France - save 31%",France,PACKAGE,378,31,2018-02-16 00:01:00.000000,2018-02-26 23:59:00.000000,10,4
"Nita by Vo Urban Resort, Siem Reap, Cambodia - save 62%",Cambodia,HOTEL,85,62,2018-02-05 00:01:00.000000,2018-02-26 23:59:00.000000,21,4
"Hotel Village, Aosta Valley, Italy - save 54%",Italy,HOTEL,79,54,2018-02-19 00:01:00.000000,2018-02-26 23:59:00.000000,7,4
"Luxurious Rome break with a sightseeing pass, Hotel Dei Mellini, Italy - save 40%",Italy,PACKAGE,550,40,2018-02-19 00:01:00.000000,2018-03-05 23:59:00.000000,14,4
"Casa Chameleon Las Catalinas, Las Catalinas, Costa Rica - save 25%",Costa Rica,HOTEL,370,25,2018-02-18 00:01:00.000000,2018-02-27 04:59:00.000000,9,4
"Stylish Greek villa holiday with private pool, Eagles Villas, Halkidiki - save 57%",Greece,PACKAGE,1398,57,2018-02-16 00:01:00.000000,2018-02-26 23:59:00.000000,10,4
"South Africa safari holiday with game drives & excursions, Manyatta Rock Camp, Kwa Madwala - save 38%",South Africa,PACKAGE,2998,38,2018-02-09 00:01:00.000000,2018-02-26 23:59:00.000000,17,4
"GPRO Valparaiso Palace Hotel & Spa, Mallorca, Spain - save 61%",Spain,HOTEL,181,61,2018-02-19 00:01:00.000000,2018-02-26 23:59:00.000000,7,4
"All-inclusive Jamaica holiday on a private adults-only peninsula, Montego Bay, Jamaica - save 50%",Jamaica,PACKAGE,2998,50,2018-02-16 00:01:00.000000,2018-02-26 23:59:00.000000,10,4
"Hotel Abalú, Madrid, Spain - save 28%",Spain,HOTEL,118.29,28,2018-02-19 00:01:00.000000,2018-02-26 23:59:00.000000,7,4
"U Palazzu Serenu, Corsica, France - save 27%",France,HOTEL,144,27,2018-02-17 00:01:00.000000,2018-02-26 23:59:00.000000,9,4
"All-inclusive Barbados beach holiday with turtle swimming, Almond Beach Resort Barbados, Caribbean - save 52%",Barbados,PACKAGE,2198,52,2018-02-20 00:01:00.000000,2018-03-05 23:59:00.000000,13,4
"The Macdonald Dona Lola Club, Malaga, Spain - save 37%",Spain,HOTEL,71,37,2018-02-19 00:01:00.000000,2018-02-26 23:59:00.000000,7,4
"Paris break with French Open tennis tickets, Hotel Mercure Paris 19 Philharmonie La Villette, France - save 25%",France,PACKAGE,638,25,2018-02-22 00:01:00.000000,2018-03-08 23:59:00.000000,14,4
"The Henderson, a Salamander Beach & Spa Resort, Destin, Florida - save 37%",USA,HOTEL,201,37,2018-02-18 00:01:00.000000,2018-02-27 04:59:00.000000,9,4
"Nikki Beach Koh Samui, Koh Samui, Thailand - save 43%",Thailand,HOTEL,4875,43,2018-02-11 00:01:00.000000,2018-02-26 23:59:00.000000,15,4
"Hotel Es Lloquet, Mallorca, Balearic Islands - save 34%",Spain,HOTEL,117,34,2018-02-19 00:01:00.000000,2018-02-26 23:59:00.000000,7,4
"Awe-inspiring Cambodia & Vietnam holiday with Halong Bay cruise, Siem Reap, Phu Loc, Hanoi & Halong Bay - save 32%",Vietnam,PACKAGE,3398,32,2018-02-05 00:01:00.000000,2018-02-26 23:59:00.000000,21,3
"Laguna Holiday Club Phuket Resort, Phuket, Thailand - save 70%",Thailand,HOTEL,2500,70,2018-02-09 00:01:00.000000,2018-02-26 23:59:00.000000,17,3
"Santhiya Tree Koh Chang Resort, Koh Chang, Thailand - save 36%",Thailand,HOTEL,3350,36,2018-02-19 00:01:00.000000,2018-02-26 23:59:00.000000,7,3
"Unforgettable Costa Rica tour with beach, San José, Arenal, Monteverde & Playa Carrillo - save 30%",Costa Rica,PACKAGE,2998,30,2018-02-19 00:01:00.000000,2018-03-12 23:59:00.000000,21,3
"Enticing Vietnam & Cambodia holiday with Halong Bay cruise, Hanoi, Halong Bay, Siem Reap & Hoi An - save 27%",Vietnam,PACKAGE,3198,27,2018-02-12 00:01:00.000000,2018-03-05 23:59:00.000000,21,3
"The Anam Resort, Nha Trang, Vietnam - save 50%",Vietnam,HOTEL,199,50,2018-02-11 00:01:00.000000,2018-02-26 23:59:00.000000,15,3
"Aqua Suites, Lanzarote, Spain - save 33%",Spain,HOTEL,182.93,33,2018-02-12 00:01:00.000000,2018-02-26 23:59:00.000000,14,3
"Quality Suites Lyon 7 Lodge, Lyon, France - save 27%",France,HOTEL,74,27,2018-02-19 00:01:00.000000,2018-02-26 23:59:00.000000,7,3
"Amara Sanctuary Resort Sentosa, Sentosa Island, Singapore - save 38%",Singapore,HOTEL,225,38,2018-02-19 00:01:00.000000,2018-02-26 23:59:00.000000,7,3
"The Morton Hotel, Bloomsbury, London - save 28%",England,HOTEL,169,28,2018-02-19 00:01:00.000000,2018-02-27 23:59:00.000000,8,3
"Fileas Art Hotel, Chania, Crete - save 33%",Greece,HOTEL,68.75,33,2018-02-19 00:01:00.000000,2018-02-26 23:59:00.000000,7,3
"Relaxing Corsica holiday near the beach, Hotel U Ricordu, France - save 21%",France,PACKAGE,930,21,2018-02-16 00:01:00.000000,2018-02-26 23:59:00.000000,10,2
"Riad dar Alhambra, Marrakech, Morocco - save 44%",Morocco,HOTEL,56.25,44,2018-02-19 00:01:00.000000,2018-02-26 23:59:00.000000,7,2
"Belmond British Pullman train trip & London stay, A chic Mayfair pad & iconic railway experience with steam train option - save 33%",England,PACKAGE,798,33,2018-02-16 00:01:00.000000,2018-02-26 23:59:00.000000,10,2
"Fantastic summer journey around Iceland, Eight-day tour from Reykjavik circling Iceland's highlights - save 29%",Iceland,PACKAGE,3198,29,2018-02-19 00:01:00.000000,2018-02-26 23:59:00.000000,7,2
"Hotel Oleana, Bergen, Norway - save 33%",Norway,HOTEL,1136,33,2018-02-11 00:01:00.000000,2018-02-26 23:59:00.000000,15,2
"Atrium Palace Thalasso Spa Resort & Villas, Rhodes, Greek Islands - save 44%",Greece,HOTEL,144.95,44,2018-02-18 00:01:00.000000,2018-02-26 23:59:00.000000,8,2
"Bucket-list Egyptian escape with Cairo & Luxor stays, Le Méridien Pyramids Hotel & Spa & Sofitel Winter Palace - save 30%",Egypt,PACKAGE,2158,30,2018-02-16 00:01:00.000000,2018-02-26 23:59:00.000000,10,2
"Relaxing Jersey break with car hire, Merton Hotel, Channel Islands - save 38%",England,PACKAGE,398,38,2018-02-16 00:01:00.000000,2018-02-26 23:59:00.000000,10,2
"Modern Barcelona city break, Renaissance Barcelona Fira Hotel, Spain - save 37%",Spain,PACKAGE,458,37,2018-02-16 00:01:00.000000,2018-02-26 23:59:00.000000,10,2
"Sirru Fen Fushi, Shaviyani Atoll, Maldives - save 55%",Maldives,HOTEL,740,55,2018-02-17 00:01:00.000000,2018-02-26 23:59:00.000000,9,2
"Sublime Sri Lanka city, nature & beach tour, Negombo, Sigiriya Rock, Kandy, Nuwara Eliya & Beruwala - save 28%",Sri Lanka,PACKAGE,3378,28,2018-02-19 00:01:00.000000,2018-03-01 23:59:00.000000,10,2
"Epic South Africa trip with safaris & Victoria Falls tour, Victoria Falls, Johannesburg, Kruger & optional Cape Town - save 27%",South Africa,PACKAGE,3498,27,2018-02-16 00:01:00.000000,2018-02-26 23:59:00.000000,10,2
"Alpe d'Huez French Alps ski holiday at a hip hideaway, Oz, France - save 45%",France,PACKAGE,1078,45,2018-02-16 00:01:00.000000,2018-02-26 23:59:00.000000,10,2
"VIK Suite Hotel Risco del Gato, Fuerteventura, Spain - save 45%",Spain,HOTEL,195,45,2018-02-04 00:01:00.000000,2018-02-26 23:59:00.000000,22,2
"Aragona Palace Hotel & Spa, Ischia, Italy - save 36%",Italy,HOTEL,63.36,36,2018-02-19 00:01:00.000000,2018-02-26 23:59:00.000000,7,2
"Ilio Mare Thassos Resort Hotel, Thassos, Greece - save 48%",Greece,HOTEL,100,48,2018-02-18 00:01:00.000000,2018-02-26 23:59:00.000000,8,2
"Coconut Boutique Resort, Lombok, Indonesia - save 49%",Indonesia,HOTEL,65,49,2018-02-19 00:01:00.000000,2018-02-26 23:59:00.000000,7,2
"Unforgettable day trip to the F1 Monaco Grand Prix 2018, Monaco, France - save 33%",Monaco,PACKAGE,1198,33,2018-02-22 00:01:00.000000,2018-03-08 23:59:00.000000,14,2
"Hotel Les Chalets du Prariand, Megève, French Alps - save 30%",France,HOTEL,116,30,2018-02-19 00:01:00.000000,2018-02-26 23:59:00.000000,7,2
"5* exceptional Maldives holiday with a beach bungalow, Kanuhura, Lhaviyani Atoll - save 45%",Maldives,PACKAGE,4578,45,2018-02-16 00:01:00.000000,2018-02-26 23:59:00.000000,10,2
"The Embassy Row Hotel, Washington, D.C., USA - save 36%",USA,HOTEL,89,36,2018-02-12 00:01:00.000000,2018-02-27 04:59:00.000000,15,2
"Charming Italy city-hop with optional Swiss Alps stay, Turin & Milan, plus optional Genoa or Interlaken - save 38%",Italy,PACKAGE,798,38,2018-02-16 00:01:00.000000,2018-02-26 23:59:00.000000,10,2
"Beachfront Portugal break, Porto Santo Hotel & Spa, Porto Santo Island - save 36%",Portugal,PACKAGE,1358,36,2018-02-16 00:01:00.000000,2018-02-26 23:59:00.000000,10,2
"All-inclusive Turkey holiday to a luxury beach resort, Selectum Luxury Resort, Belek - save 43%",Turkey,PACKAGE,998,43,2018-02-14 00:01:00.000000,2018-02-26 23:59:00.000000,12,2
"All-inclusive Antigua holiday at an award-winning bolthole, Villas at Sunset Lane, Caribbean - save 45%",Antigua And Barbuda,PACKAGE,2398,45,2018-02-16 00:01:00.000000,2018-02-26 23:59:00.000000,10,2
"Awe-inspiring Brazil tour with Iguazú Falls visit & Amazon stay, Rio, Iguazú Falls, Manaus, the Amazon & São Paulo - save 40%",Brazil,PACKAGE,3798,40,2018-02-09 00:01:00.000000,2018-02-26 23:59:00.000000,17,1
"Cardinal Hotel St. Peter, Rome, Italy - save 63%",Italy,HOTEL,85,63,2018-02-22 00:01:00.000000,2018-03-05 23:59:00.000000,11,1
"Iulius Suite & Spa, Puglia, Italy - save 61%",Italy,HOTEL,99,61,2018-02-05 00:01:00.000000,2018-02-26 23:59:00.000000,21,1
"Château de Verrières, Saumur, Loire Valley, France - save 31%",France,HOTEL,221,31,2018-02-11 00:01:00.000000,2018-02-26 23:59:00.000000,15,1
"Blissful Thailand city & beach escape with super-luxe hotels, Shangri-La stays in Bangkok & Chiang Mai, plus Koh Samui - save 26%",Thailand,PACKAGE,3598,26,2018-02-19 00:01:00.000000,2018-03-12 23:59:00.000000,21,1
"The Historic Powhatan Resort, Williamsburg, Virginia - save 39%",USA,HOTEL,55,39,2018-02-19 00:01:00.000000,2018-02-27 04:59:00.000000,8,1
"Caribbean beachfront escape, Oualie Beach Resort, Saint Kitts & Nevis - save 50%",Saint Kitts And Nevis,PACKAGE,2798,50,2018-02-09 00:01:00.000000,2018-02-26 23:59:00.000000,17,1
"NFL American football game at Club Wembley, Crowne Plaza Hotel London Ealing, West London - save 21%",England,PACKAGE,598,21,2018-02-22 00:01:00.000000,2018-03-08 23:59:00.000000,14,1
"Unforgettable Cambodia & Vietnam holiday with Halong Bay cruise, Siem Reap, Hanoi, Halong Bay, Hoi An & Ho Chi Minh City - save 29%",Vietnam,PACKAGE,2578,29,2018-02-19 00:01:00.000000,2018-03-05 23:59:00.000000,14,1
"F1 French Grand Prix 2018 with Marseille hotel stay, Kyriad Marseille Palais Des Congrès – Vélodrome, France - save 20%",France,PACKAGE,798,20,2018-02-22 00:01:00.000000,2018-03-08 23:59:00.000000,14,1
"Sensational Singapore city break & Thailand beach-hop, Singapore, Khao Lak & Phuket - save 31%",Thailand,PACKAGE,2698,31,2018-02-19 00:01:00.000000,2018-03-12 23:59:00.000000,21,1
"CIRC Hotel, Hollywood, Florida - save 41%",USA,HOTEL,127,41,2018-02-19 00:01:00.000000,2018-02-27 04:59:00.000000,8,1
"All-inclusive Rhodes holiday, All Senses Nautica Blue Rhodes, Greece - save 26%",Greece,PACKAGE,858,26,2018-02-16 12:20:00.000000,2018-02-26 12:20:00.000000,10,1
"Grand Hyatt Doha Hotel & Villas, Doha, Qatar - save 50%",Qatar,HOTEL,196,50,2018-02-19 00:01:00.000000,2018-02-26 23:59:00.000000,7,1
"Negroponte Resort Eretria, Evia, Greece - save 45%",Greece,HOTEL,97.5,45,2018-02-19 00:01:00.000000,2018-02-26 23:59:00.000000,7,1
"The Inn at Union Square, San Francisco, USA - save 25%",USA,HOTEL,199,25,2018-02-21 00:01:00.000000,2018-03-06 04:59:00.000000,13,1
"Sensational British Grand Prix break, A choice of hotels in Great Malvern, Worcestershire - save 24%",England,PACKAGE,798,24,2018-02-22 00:01:00.000000,2018-03-08 23:59:00.000000,14,1
"5* Costa Dorada summer holiday at a beachside resort, Le Méridien Ra Beach Hotel & Spa, Spain - save 14%",Spain,PACKAGE,1238,14,2018-02-19 00:01:00.000000,2018-02-26 23:59:00.000000,7,1
"5* Corfu holiday at a romantic hilltop resort, Corfu Holiday Palace Resort & Spa, Greece - save 36%",Greece,PACKAGE,738,36,2018-02-16 00:01:00.000000,2018-02-26 23:59:00.000000,10,1
"Incredible Thailand city-to-beach holiday, Bangkok, Chiang Mai & Phuket - save 30%",Thailand,PACKAGE,2678,30,2018-02-12 00:01:00.000000,2018-03-05 23:59:00.000000,21,1
"Villa del Sol Zihuatanejo, a Destination Hotel, Zihuatanejo, Mexico - save 47%",Mexico,HOTEL,249,47,2018-02-19 00:01:00.000000,2018-02-27 23:59:00.000000,8,1
"Malaysia & Sri Lanka tour with optional beach break, Kuala Lumpur, Cameron Highlands, Nuwara Eliya & more - save 24%",Sri Lanka,PACKAGE,4998,24,2018-02-05 00:01:00.000000,2018-02-26 23:59:00.000000,21,1
"5* Thailand city-to-coast holiday, Bangkok & Krabi - save 27%",Thailand,PACKAGE,3798,27,2018-02-05 00:01:00.000000,2018-02-26 23:00:00.000000,21,1
"Vintage luxury train to the Grand National with a London hotel stay, Northern Belle train travel & Ambassadors Bloomsbury stay - save 14%",England,PACKAGE,1098,14,2018-02-22 00:01:00.000000,2018-03-08 23:59:00.000000,14,1
"Costa Brava beach base with Spanish Grand Prix tickets, Hotel Marsol, Lloret de Mar - save 18%",Spain,PACKAGE,398,18,2018-02-22 00:01:00.000000,2018-03-08 23:59:00.000000,14,1
"Salgados Palace, Algarve, Portugal - save 49%",Portugal,HOTEL,112.5,49,2018-02-19 00:01:00.000000,2018-02-26 23:59:00.000000,7,1
"Monte Carlo break with a choice of Masters tennis matches, Hotel Prince de Galles, Côte d'Azur - save 14%",France,PACKAGE,0,14,2018-02-22 00:01:00.000000,2018-03-08 23:59:00.000000,14,1
"Rome break with Six Nations Italy vs Wales rugby tickets, Crowne Plaza Rome - St. Peter's, Italy - save 22%",Italy,PACKAGE,1398,22,2018-02-22 00:01:00.000000,2018-03-08 23:59:00.000000,14,1
"Luxurious Turkey holiday by the sea, Mini Saray Hotel, Antalya - save 42%",Turkey,PACKAGE,798,42,2018-02-16 00:01:00.000000,2018-02-26 23:59:00.000000,10,1
"SIXTY SoHo, Soho, New York - save 47%",USA,HOTEL,256,47,2018-01-29 00:01:00.000000,2018-02-27 04:59:00.000000,29,1
"Avani Quy Nhon Resort and Spa, Quy Nhon, Vietnam - save 48%",Vietnam,HOTEL,95,48,2018-02-19 00:01:00.000000,2018-02-26 23:59:00.000000,7,1
"The Apsara Rive Droite, Luang Prabang, Laos - save 57%",Laos,HOTEL,100,57,2018-02-12 00:01:00.000000,2018-02-26 23:59:00.000000,14,1
"Unforgettable Indonesia holiday with stunning island tours, Ubud, Gili Islands, Lombok & Sanur - save 28%",Indonesia,PACKAGE,3178,28,2018-02-19 00:01:00.000000,2018-03-12 23:59:00.000000,21,1
"Breathtaking Thailand island-hopping holiday, Koh Samui, Koh Phangan & Koh Tao - save 23%",Thailand,PACKAGE,3298,23,2018-02-12 00:01:00.000000,2018-03-05 23:59:00.000000,21,1
"Fascinating Jordan tour with iconic excursions, Amman, Petra, Dead Sea & Wadi Rum - save 35%",Jordan,PACKAGE,1998,35,2018-02-02 00:01:00.000000,2018-02-26 23:59:00.000000,24,1
"Sugar Ridge, Antigua, Caribbean - save 26%",Antigua And Barbuda,HOTEL,195,26,2018-02-18 00:01:00.000000,2018-02-27 04:59:00.000000,9,1
"Sensational Japan tour with Mount Fuji visit & excursions, Tokyo, Kanazawa, Kyoto, Osaka & Nagoya - save 0%",Japan,PACKAGE,4138,0,2018-02-19 00:01:00.000000,2018-03-05 23:59:00.000000,14,1
"Aloft Abu Dhabi, Abu Dhabi, UAE - save 60%",United Arab Emirates,HOTEL,400,60,2018-02-12 00:01:00.000000,2018-02-26 23:59:00.000000,14,1
