"The Oberoi Rajvilas Jaipur, Jaipur, India - save 27%",India,HOTEL,537.5,27,2018-02-18 00:01:00.000000,2018-02-26 23:59:00.000000,8,1
"Le Domaine de Dony, Balbins, France - save 30%",France,HOTEL,109,30,2018-02-19 00:01:00.000000,2018-02-26 23:59:00.000000,7,1
"5* Singapore & Penang holiday, Shangri-La hotels in Singapore & Peninsular Malaysia - save 36%",Singapore,PACKAGE,3338,36,2018-02-05 00:01:00.000000,2018-02-26 23:59:00.000000,21,1
"A charming Tuscany stay with Andrea Bocelli concert tickets, Calamidoro Hotel, Italy - save 20%",Italy,PACKAGE,1590,20,2018-02-16 00:01:00.000000,2018-02-26 23:59:00.000000,10,1
"Luxury Iceland suite stay with whale-watching & optional tours, Reykjavik Marina Residence, Reykjavik - save 45%",Iceland,PACKAGE,1198,45,2018-02-12 00:01:00.000000,2018-02-26 23:59:00.000000,14,1
"Luxury Egypt Nile cruise with excursions, Dahabiya Merit, Egypt - save 38%",Egypt,PACKAGE,2798,38,2018-02-09 00:01:00.000000,2018-02-26 23:59:00.000000,17,1
"Palazzo Ducale Venturi, Lecce, Italy - save 48%",Italy,HOTEL,183,48,2018-02-17 00:01:00.000000,2018-02-26 23:59:00.000000,9,1
"Newstead Belmont Hills Golf Resort & Spa, Bermuda, Caribbean - save 60%",Bermuda,HOTEL,229,60,2018-02-12 00:01:00.000000,2018-02-27 04:59:00.000000,15,1
"5* Borneo & Dubai escape with orangutan experience, Malaysia & UAE - save 28%",Malaysia,PACKAGE,3298,28,2018-02-12 00:01:00.000000,2018-03-05 23:59:00.000000,21,1
"5* getaway to beautiful Aix-en-Provence, Renaissance Aix-en-Provence Hotel, France - save 24%",France,PACKAGE,658,24,2018-02-16 00:01:00.000000,2018-02-26 23:59:00.000000,10,1
"Benvengudo, Provence, France - save 27%",France,HOTEL,150.48,27,2018-02-19 00:01:00.000000,2018-02-26 23:59:00.000000,7,1
"Nile cruise with iconic sightseeing & all-inclusive beach stay, MS Jaz Jubilee & LABRANDA Gemma Premium Resort, Egypt - save 41%",Egypt,PACKAGE,1698,41,2018-02-16 00:01:00.000000,2018-02-26 23:59:00.000000,10,1
"Casa de Campo Resort & Villas, Dominican Republic, Caribbean - save 67%",Dominican Republic,HOTEL,199,67,2018-02-09 00:01:00.000000,2018-02-27 04:59:00.000000,18,1
"5* Southern Italy holiday, Hotel Marinagri Hotel, Policoro - save 42%",Italy,PACKAGE,1358,42,2018-02-16 00:01:00.000000,2018-02-26 23:59:00.000000,10,1
"Luxury Singapore & Bali holiday with excursions, Singapore, Ubud & Nusa Dua - save 24%",Singapore,PACKAGE,3798,24,2018-02-05 00:01:00.000000,2018-02-26 23:59:00.000000,21,1
"Electrifying MotoGP™ Barcelona stay with race tickets, Senator Barcelona Spa Hotel, Spain - save 18%",Spain,PACKAGE,598,18,2018-02-22 00:01:00.000000,2018-03-08 23:59:00.000000,14,1
"Hotel Saccardi & Spa, Sommacampagna, near Verona, Italy - save 45%",Italy,HOTEL,65,45,2018-02-22 00:01:00.000000,2018-03-05 23:59:00.000000,11,1
"Serene Sardinia sojourn near the beach, Lantana Resort, Italy - save 32%",Italy,PACKAGE,1636,32,2018-02-16 00:01:00.000000,2018-02-26 23:59:00.000000,10,1
"Hôtel de l'Image, Saint-Rémy-de-Provence, France - save 56%",France,HOTEL,132,56,2018-02-11 00:01:00.000000,2018-02-26 23:59:00.000000,15,1
"Vichy Thermalia Spa Hotel, Near Montpellier, France - save 30%",France,HOTEL,125,30,2018-02-16 00:01:00.000000,2018-02-26 23:59:00.000000,10,1
"Thrilling Abu Dhabi F1 Grand Prix break, Cristal Hotel Abu Dhabi, UAE - save 29%",United Arab Emirates,PACKAGE,2198,29,2018-02-22 00:01:00.000000,2018-03-08 23:59:00.000000,14,1
"Barcelona city break with tickets to FC Barcelona vs. Athletic Bilbao league match, Expo Hotel Barcelona & football tickets, Spain - save 18%",Spain,PACKAGE,398,18,2018-02-22 00:01:00.000000,2018-03-08 23:59:00.000000,14,1
"Thrilling Moscow & St Petersburg tour with iconic excursions, Vega Hotel & Convention Center & The Brothers Karamazov Hotel, Russia - save 36%",Russia,PACKAGE,1138,36,2018-02-16 00:00:00.000000,2018-02-26 23:59:00.000000,10,1
"Exhilarating Belgian Grand Prix break, Bronze F1 tickets & a central Brussels stay - save 41%",Belgium,PACKAGE,998,41,2018-02-22 00:01:00.000000,2018-03-08 23:59:00.000000,14,1
"Rome break with Six Nations Italy vs Scotland rugby tickets, Hotel Londra & Cargill, Italy - save 25%",Italy,PACKAGE,298,25,2018-02-22 00:01:00.000000,2018-03-08 23:59:00.000000,14,1
"Hôtel Atalante Relais Thalasso & Spa, Île de Ré, France - save 39%",France,HOTEL,149,39,2018-02-16 00:01:00.000000,2018-02-26 08:59:00.000000,10,1
